header	text	verdict	link
🔸 Зачем я поддерживаю английский когда итак живу в англоязычной среде? 😄	"Всем привет! Наверное, по время пандемии различный онлайн-школы начали набирать обороты, хотя я начала заниматься ещё до прихода к нам короновируса Я живу в ОАЭ, работаю в IT-сфере в интернациональной команде, где очень много коммуникации на английском (как по рабочим вопросам, так и межкультурное). Для меня лично моего технического английского вполне достаточно, а вот для общения хотелось бы побольше каких-то фраз, речевых оборотов, улучшить свой вокабуляр. Также я хочу через год сдать IELTS для возможности получить визу Австралии. SkyEng предлагает вам бесплатное ""занятие"", если это можно так назвать) Это созвон с менеджером, который с вами разговаривает и определяет ваш уровень. Вот тут я столкнулась с огромной проблемой, потому что для меня неправильно определили уровень моего языка и отправили на B1. За пару занятий на B1 я практически разочаровалась в курсах, потому что почти ничего нового для себя не выносила. Когда писала менеджеру с просьбой перевести меня на другой уровень - ответили. что так нельзя. К счастью, мой учитель сам перевёл меня на уровень B2, где мне сейчас очень комфортно и полезно обучаться 😄 Тут, как и много где, работает это ""чем больше покупаешь - тем меньше стоимость занятия"". Я за 32 занятия платила где-то 360$, далее брала по 8 занятий, что стоит чуть больше 100$ (112$ если я не ошибаюсь). Также занятия можно спокойно переносить, брать ""отпуск"" или возвращать средства. Первый раз вы можете выбрать для себя преподавателя самостоятельно, видя перед собой его фото, имея возможность прослушать его акцент и увидеть его расписание Далее, если вы хотите сменит преподавателя, то вам такой возможности не предоставляется, к сожалению. Вам звонит менеджер и спрашивает удобное для вас время и дни и сам подбирает для вас преподавателя. Девушка, которую я разу же выбрала, ещё до первого занятия ушла в отпуск и меня отправили к какому-то парню, который был, если честно, ну никакой. Возможно, я ещё недовольна была лёгким материалом и поэтому первое впечатление у меня было ужасное; Далее я попросила сменить и мне дали явно более сильного преподавателя, который несколько лет прожил в Америке (я считаю, что гораздо лучше будет знать английский тот человек, который жил в этой среде, а не просто закончил какой-либо лингвистический универ). Теперь я наконец-то занимаюсь на нужном уровне и с преподавателем, которым я довольна 🔸 В школе SkyEng заниматься можно как на сайте с браузера на компьютере, так и с мобильного приложения. Я безумно довольна этим приложением (хотя и оно не без багов): Домашняя работа приходит туда и сразу приложение проверяет правильно или неправильно вы выбрали: Так выглядит список домашних заданий) Также очень крутая возможность учить слова: можно добавлять слова целыми ""наборами"" (например, для сериала, книги или по теме): Слова на ярких удобных карточках с картинками, транскрипцией и примерами использования: Также приложение ведёт статистику и количество выученных слов. В ""Личном Кабинете"" тоже есть своя доска со статистикой и достижениями: Во время урока мне очень нравится интерактивная доска и возможность сразу же применять правила. Также так всегда есть какие-то статьи и видео) Кстати, если вы перестаёте брать уроки в SkyEng, то вам всё равно будет открыт доступ к приложению. 🔸 Если кто-то зарегистрируется в школе с вашим промокодом, то вам и вашему друго будет по +2 занятия английским (так что если для кого-то мой отзыв станет решающим - то welcome, будет круто) 🔸 Очень удобная онлайн-школа, особенно для тех, кто живёт за рубежом. Гибкая система и отличное приложение. Цена может показаться вам высоковатой, но вы платите за крутой интерактивный интерфейс, гибкость и отличную возможность заниматься самостоятельно с помощью приложения."	1	https://irecommend.ru/content/zachem-ya-podderzhivayu-angliiskii-kogda-itak-zhivu-v-angloyazychnoi-srede
По корпоративному тарифу можно заниматься	Очень давно не занималась английским и чувствовала, что многое забыла из грамматики, да и барьер какой-то, когда долго не занимаешься, при разговоре. Была уверена, что мой уровень intermediate и что заниматься мне следует с уровня upper-intermediate. Чуть более года назад прошла тест и начала очно в небольшой группе заниматься на уровне intermediate. Осознала в очередной раз, что занятия в группе не для меня, т.к. у всех свои знания, свои пробелы, а мне бы хотелось, чтобы уделялось внимание именно моим пробелам. Коллега посоветовала Skyeng. Наша компания оказалась подключена к корпоративным тарифам и на тот момент 1 занятие с русскоязычным преподавателем стоило 690 руб.за 50 мин., остальным ученикам такая стоимость урока доступна при единовременной оплате 64 занятий. Коллега отправила мне пригласительную ссылку, за которую и ей и мне полагалось по 2 урока в подарок. Мне потом позвонили из школы и сказали, что у них еще более крутая акция: при оплате до какого-то числа мне дадут 4 урока в подарок, что я и сделала. При этом коллеге не хотели давать те 2 урока за то, что она меня пригласила, аргументирую это тем, что тарифы итак корпоративные. В итоге ей подарили 1 урок. Я прошла пробный урок и мне очень понравилось, но молодой человек сказал, что мне следует заниматься с конца уровня pre-intermediate. Далее я озвучила примерное время занятий и дни, пожелания по поводу преподавателя и мне назначили молодую девушку в качестве учителя. На первом уроке она рассказала о себе, расспросила обо мне, узнала, какие темы мне интересны для обсуждения, цели изучения английского. Не смотря на молодой возраст, учитель произвела на меня очень хорошее впечатление, она все время пыталась меня разговорить, мы каждый урок уделяли внимание разговорам, она задавала мне разные вопросы обо мне, о моем мнении на различные ситуации и тд. Кроме того, она практически все слова знала, которые я спрашивала и очень хорошо была подкована в грамматике. Преподаватель старалась подбирать мне уроки по обозначенной мне интересной теме, кроме того, там все время каждый урок новая интересная тема. Большинство уроков интерактивные на базе их платформы. Заниматься с десктопной версии удобнее, но периодически приходится заниматься с телефона и тоже нормально. Особенно удобно, когда едешь в транспорте с работы, можно открыть приложение и делать домашку, учить слова. Приложу несколько фото десктопной версии личного кабинета и домашней работы. Учить слова гораздо удобнее и интереснее, нежели, когда ты просто записываешь их в тетрадь и зубришь. Там и на слуховую и на зрительную память, на правописание. Приложу фото для наглядности из приложения в телефоне. Хочу отметить, что уроки можно заранее переносить, отменять и можно брать перерывы с сохранением расписаний. За время занятий я узнала очень много и слов и правил, такое ощущение, что я много упустила, занимаясь в школьные годы. Из общий впечатлений скажу, что это полноценный урок с преподавателем, который уделяет 50 минут именно тебе, твоим знаниям и пробелам, при этом, тебе не нужно никуда ехать, тратить время и силы на дорогу и это гораздо лучше занятий в группе и, пожалуй, даже интереснее обычных очных занятий с учителем. Кроме того, это гораздо дешевле, чем заниматься очно, особенно, на корпоративных тарифах. Подведя итоги, скажу, что я бы рекомендовала занятия. Если хотите получить в подарок 2 занятия, напишите в личку, я дам ссылку.	1	https://irecommend.ru/content/po-korporativnomu-tarifu-mozhno-zanimatsya
Негативный опыт от человека, который решил бесплатно пройти пробный урок.	"Всем привет! В мае 2019 года, я решила проверить свой уровень английского, хоть и предполагала, что у меня Intermediate, записалась на бесплатное занятие. Онлайн-урок длился минут 45, созвон идет с онлайн платформы, есть видео, этапы следующие: В итоге молодой человек указал мне на линию уровней ровно в центр, Intermediate, как и ожидалось. Дальше, был рассказ о ценах, но это было для меня довольно дорого на тот момент. Но я сказала, что подумаю...О как же я ошиблась! Надо было сказать не хочу и не буду. А потом начались звонки практически через каждые три дня (возможно и раз в неделю, но спустя некоторое время мне так кажется). ""Вы проходили у нас пробный урок, готовы приступить к платным занятиям?"" и я говорила нет, каждый раз... В итоге мне звонили с разных номеров, начинающихся на 8495 вплоть до октября... Это расплата за бесплатные занятия! Иногда хотелось просто взять и согласиться, чтоб отстали. И думаю некоторые люди так и делаю. В общем, если у вас нет четкого понимания, что вы хотите дальше ходить на платные занятия, лучше не проходите ""бесплатный"" пробный урок, иначе, велика вероятнось, что вам как и мне будут названивать долго-долго. Вам также может понравится:"	0	https://irecommend.ru/content/negativnyi-opyt-ot-cheloveka-kotoryi-reshil-besplatno-proiti-probnyi-urok
одни технические неполадки, 15 минут обучения и 35 мин перезагрузок и зависаний	Пользуюсь около 6 месяцев. Каждый раз порывалась остановить обучение на платформе, потому что сама платформа работает ужасно. Служба поддержки отвечает быстро , но после часа перегрузок, скачивали приложений каких-то разных, тестирования... вообщем час пустого времени, пишут всегда один результат: обратитесь к провайдеру. Причина в плохом интернете. Хотя другие платформы обучающие работают, нигде нет таких проблем, только со skyeng. Вообщем продуктивность урока 15% Урок длится 50 минут, из них 15 минут в общей сложности занятия и 35 минут обновлений страницы, зависаний, то звук от картинки отстает, то видео на уроке не грузится, то экран подвис, то вообще не заходит, нужно сидеть и чего то ждать, то нельзя наушники использовать беспроводные (из-за них по их мнению не работает платформа...). Почему все 6 месяцев терпела: преподаватель супер, очень не хочу ее терять, но терпение закончилось и все таки существует очень большое разнообразие платфор, думаю с лучше работой и без пустой траты времени. Еще словарь в приложении мобильном хороший, но тоже того не стоит, с таким успехом можно и репетитора нанять, сумма примерно та же.	0	https://irecommend.ru/content/odni-tekhnicheskie-nepoladki-15-minut-obucheniya-i-35-min-perezagruzok-i-zavisanii
Сильно завышена цена занятий	В 2019 году решила поучить английский, так как очень заманчиво было не ехать на занятия, выбирать удобное время. Скажу так, я постоянно учу английский и моего уровня хватает в поездках и для общения с иностранцами, хотя не скажу, что владею свободно. Могу сказать любую фразу, возможно изменив ее, заменив синонимами некоторые слова. Понимать начинаю минут через 20-30 плотного общения, когда отключаю контроль... и темп конечно влияет на восприятие, чем медленнее говорит собеседник, тем больше понимания. Прошла пробный урок и озвучила своё пожелание, что мне нужно именно говорение, типа speaking Club, а так же сделать акцент на произношение, так как хотелось бы его подправить. Меня заверили, что все мои пожелания будут учтены. Но на первом же уроке началось чтение, текстовые задания, в общем все то, что можно выполнять используя миллионы приложений для изучения английского языка. На мои вопросы педагог сказала, что это стандартная программа и без этого обойтись невозможно, но мы постараемся свести к минимуму задание в программе и больше говорить. В общем, все мои занятия я провела 80% времени в программе. По итогам уроков выставлялись оценки в бальной системе, оценивающие мои навыки и динамику	0	https://irecommend.ru/content/silno-zavyshena-tsena-zanyatii
Зависает, просто невозможно заниматься, навязчивые продажи	Сервис не единственный, но разрекламированный, поэтому решили попробовать. Заниматься было рекомендовано с компьютера. Включили ноутбук. Висит, слышно с задержкой, общаться невозможно. Включили планшет-более менее, слышно и видно преподавателя, правда перезагрузилисть за урок несколько раз. Интерактивные картинки было видно, но кнопочки на них не нажимались. У нас нормальный интернет, достаточный для работы на удалёнке. Никаких проблем с Ютуб, Скайпом ранее не было. Планшет достаточно новый. Проблемы, видимо, у этой школы с программным обеспечением. И я читала такое в отзывах. Сам пробный урок по большей части- это активная, навязчивая продажа. Но, все же о плюсах. Мультяшные герои, интерактивные задания. Домашние работы на компьютере и разговорный клуб то-ли бонусом, то-ли за 1500 р. Если у Вас есть как оборудование, подходящее именно для этой школы, может андроид какой-нибудь особой версии или сверхскорость, или часовой пояс такой, когда Европа спит, то может и стоит купить абонемент. Но, только сначала попробуйте заниматься на бесплатном уроке. И, имейте ввиду, что Вас там будут обрабатывать на покупку курса. Цены на уроки у них такие: В интернете огромное множество школ и репетиторов. Чаще они занимаются по Зуму или Скайпу. Реже встречаются школы со своими интерактивными программами. Но, как правило, занятия по Зум и Скайпу имеют длительность 45 мин, 1 час, 1,5 часа. У Скайенга занятие короткое. Они считают, что это не минус, потому что оно эффективное. Некоторые школы предлагают занятия с носителями, чаще с уровня intermediete. Мне даже встретилась реклама школы, где с нулевого уровня занятия проходят с носителем и ненамного дороже обычных. У Скайенга есть занятия с носителем, но с определенного уровня. В моем регионе можно найти обычные очные занятия по цене 2500 р за месяц или 500 р за индивидуальное занятие с репетитором. Возможно, в Вашем регионе цены онлайн-школы покажутся Вам выгодными. В настоящее время я выбрала занятия в интерактивной форме с репетитором для изучения самых основ. Причем на платформе, которая отлично работает и не имеет подобных Скайенгу проблем с загрузкой на моем планшете. В дальнейшем планирую воспользоваться оффлайн занятиями, живое общение имеет свои плюсы.	0	https://irecommend.ru/content/zavisaet-prosto-nevozmozhno-zanimatsya-navyazchivye-prodazhi
