header	text	verdict	link
Мне нравится, что платформа удобная и что я могу выбирать, через какую активность продвигаться в изучении языка.	Я недавно занимаюсь в школе Skyeng и мне нравится. Постепенно осваиваю новые опции. Сейчас поглядываю в сторону аудио и видео, т.к. аудирование даётся мне труднее всего. Выбираю функции под настроение и имеющееся время. Например, если сил и времени мало, использую тренажер для запоминания слов: пять минут - и-то вперед. Удобно, что домашнее задание даётся и выполняется здесь же, на платформе. Удобно, что всё в одном месте - и словарь, и записная книжка, и грамматика. Навигация понятная, комфортная. Могу заниматься с ноутбука, а могу с телефона - всё синхронизировано. Это не первая моя попытка повысить уровень владения языком. Пока рано говорить, будет ли она успешной - нужно больше времени. С точки зрения пользователя платформы меня всё более чем устраивает. С преподавателем тоже всё хорошо. Но даже если почувствую, что что-то идёт не так, можно сменить - школа даёт такую возможность. Пожалуй, возможность выбирать (время, форматы, преподавателя и т.д.) и удобство, понятность платформы - главные для меня достоинства. Предполагаю, что методически процесс обучения тоже хорошо продуман, т.к. на каждом занятии и в домашней работе сочетаются разные виды навыков.	1	https://irecommend.ru/content/mne-nravitsya-chto-platforma-udobnaya-i-chto-ya-mogu-vybirat-cherez-kakuyu-aktivnost-prodvig
найдут подход к каждому	Начала заниматься в школе скайэнг недавно, пока все очень нравится. Легкий и удобный подбор преподавателей, занятия в любое удобное вам время. Особенно понравился формат Talks, очень приятные спикеры, после каждого разговора тебе приходит развернутое сообщение, в котором подробно описываются ошибки, на что стоит обратить внимание, спикеры подстраиваются под любую тему. Немного смущает цена за некоторые пакеты, но в целом если брать побольше и в рассрочку, то выходит нормально. И кстати, отдельный плюсик за чат поддержки! Работают быстро, отвечают на любой вопрос и предлагают пути решения. Пока я довольна	1	https://irecommend.ru/content/naidut-podkhod-k-kazhdomu
Хорошая онлайн школа для изучения английского языка	Подписана на ютуб канал skyeng. Подкупил интересный и познавательный контент, решила попробовать учить английский в их школе, до этого изучала в другой. у школы очень удобное основное приложение, а также есть дополнительные приложения для аудирования. Кроме основного плана и домашних заданий, есть также возможность слушать книги на английском, смотреть лекции и тд. Выбор преподавателя - отдельный бонус! Если вы хотите сами выбрать, то есть возможность послушать произношение, почитать небольшое резюме. Если для вас это не важный пункт, то школа назначает преподавателя сама, исходя из выбранного вами расписания занятий. Преподаватель, которого выбрала я, мне очень нравится. Кроме основного плана , дают всегда дополнительную информацию, например, по произношению и тд. Всегда отвечают на вопросы и помогают разобраться в материале до конца:)	1	https://irecommend.ru/content/khoroshaya-onlain-shkola-dlya-izucheniya-angliiskogo-yazyka
Доступно	Уже второй год занимаюсь на платформе. Нравится доступность - у меня много командировок и плотно совмещать , не зависишь от места . Занимайся хоть дома , хоть в кафе. Лайф хак - у меня Ростелеком интернет , я коплю бонусы и ими оплачиваю дополнительные уроки при покупке пакета от 8 уроков на платформе у них, плюс дают по 2 бесплатных занятия за приведённого друга . Главное - выбрать учителя по душе , я вот не с первого паша нашла прям идеального для себя , по чувству юмора , материалу и подходу , но сейчас очень довольна . Думаю второй язык испанский ещё там начать учить. и приложение у них классное - удобное , доступно 24 часа в сутки , повторяй слова да видео смотри только так	1	https://irecommend.ru/content/dostupno-21
Очень рекомендую, отличная школа для любого уровня!	Занимаюсь в онлайн-школе Skyeng уже почти 5 месяцев и мне все очень нравится! Отличная служба поддержки, помогли изначально очень быстро разобраться со всеми моими вопросами. Я занимаюсь сразу с двумя прекрасными преподавателями, у каждого свой особенный и интересный подход. Довольна также самой платформой: удобный формат домашних работ, хорошие задания на изучение слов на каждый день, а также есть доступ к другим классным возможностям (например, читать книги на английском и сразу смотреть перевод слов, добавлять их себе в словарь + есть аудиоверсии каждой книги, что помогает правильно понимать произношение) Из важных нюансов, конечно же, подобрать хорошего преподавателя (или двух), так как от этого в первую очередь и будет зависеть ваш опыт пользования платформой. Выбрать вы можете как самостоятельно (этот процесс очень удобно настроен), так и с помощью службы поддержки. Также преподавателя всегда можно изменить, если понимаете, что он вам не подходит)	1	https://irecommend.ru/content/ochen-rekomenduyu-otlichnaya-shkola-dlya-lyubogo-urovnya
Отличный способ изучать и поддерживать английский!	Занимаюсь в skyeng около 3х лет с перерывами. Очень нравится платформа, формат домашних заданий, разнообразие тем и глубина их проработки. Мне повезло с преподавателями, мы проговаривали мои цели и в ходе уроков делали акцент на нужные навыки. В то же время я убеждена, что 90% успеха зависит от самого ученика и его мотивации. Здорово, что платформа развивается и появляются дополнительные активности. Раньше пробовала разговорный клуб, сейчас в планах начать практику с англоязычным преподавателем. Также нравится мобильное приложение и расширение для браузера, с помощью которого можно читать ресурсы на английском языке и сразу вносить новые слова в свой словарь.	1	https://irecommend.ru/content/otlichnyi-sposob-izuchat-i-podderzhivat-angliiskii
Отличная современная онлайн школа, которая поможет вам выучить наконец английский!)	Здравствуйте! Я, как и многие, в школе изучала английский язык. Но за долгие школьные годы знания мне почему то так и не пришли (хотя есть конечно причина - отсутствие учителей). Пару лет назад я осознала, что действительно хочу выучить английский, для себя. Конечно мне не хотелось тратить деньги на репетиторов и я пыталась учить сама. Что то было понятно, что то нет. Но тут самое главное это мотивация....а она дама капризная. То есть, то нет. В итоге обучение мое продвигалось со скоростью улитки. Толчком к усиленному обучению для меня стало то, что я начала смотреть фильмы в оригинале на сайте ororo.tv (уж очень мне хотелось понимать, о чем же говорят любимые герои) и знакомство с девочкой из Америки на сайте italki (она учит русский, поэтому у нас получался языковой обмен). Но после первого же разговора с ней я поняла, что срочно нужно что то делать, ибо я не могла сказать сама ничего кроме Как дела и Откуда ты. Про школу я узнала на от моих любимых блогеров, на которых я подписана. Я решила попробовать и записалась на пробный урок (он кстати бесплатный). Пробный урок длится 50 минут и на нем позитивная девочка менеджер будет рассказывать вам о всех преимуществах школы, проведет оценку вашего уровня знаний и познакомит с платформой, на которой ведется обучение. Скажу честно, пробный урок это просто реклама школы и чуть чуть разговора на английском. Ничего нового вы на нем точно не узнаете. После прохождения пробника вам начинает звонить менеджер с целью узнать, готовы ли вы купить пакет занятий. Изначально цены у них конечно завышены. Цена за 4 урока была около 4000 руб.Согласитесь, дороговато. Я озвучила менеджеру, что не готова отдавать такую сумму. В итоге мне скинули цену до 2700 руб., сказав, что это индивидуальное предложение Only for you как говорится ( чему я конечно же не поверила). Тоже высоко, но уже более правдоподобно. Я очень долго думала, советовалась с мужем и в итоге решилась попробовать и оплатила 4 занятия. Мне подобрали преподавателя согласно моим пожеланиям (вы можете выбрать пол, возраст, интересы). Назначили удобное время для занятий. И вот мой первый урок настал. Для занятия вам понадобится компьютер со стабильным интернетом, Skype (туда заранее добавляется ваш преподаватель и скидывает ссылку для выхода в учебный класс) и Google Chrome (их платформа работает на нем, но в принципе и на других браузерах тоже тянет, проверено). Еще сюда уже для вашего удобства можно добавить веб камеру, микрофон и наушники. Урок длится 50 минут. Итак, покажу как выглядит урок на этой платформе: После каждого урока учитель дает вам домашнее задание (вы можете выбрать объем этого задания или отказаться совсем). Выглядит это так: Покажу еще личный кабинет: Здесь куча вкладок. Сразу видим на главной наш баланс занятий, баллы и прочее. Сайт предлагает скачать приложение для мобильного телефона Слова (во время урока можно добавить неизвестные слова в словарь и потом тренировать их в приложении). Еще у них появился онлайн кинотеатр с фильмами в оригинале и умными субтитрами, но он платный даже для студентов школы. В этом плане ororo.tv мне нравится больше и цены там ниже. Во кладке Преподаватель можно посмотреть информацию о вашем преподавателе ( возраст, образование, опыт работы и интересы). Вот моя страничка с записями преподавателя с уроков (вкладка Мои заметки): Еще в школе появился Разговорный клуб. В нем вы можете тренировать устную речь. Все также онлайн собирается народ согласно уровню языка и преподаватель и обсуждается определенная тема. Elementary: Подводя итог хочу сказать, что есть в этой школе и свои минусы и свои плюсы. Из плюсов: - не надо никуда ехать, все происходит дома в удобное для вас время - вы всегда можете откорректировать свою программу обучения (я например сначала была не особо довольна программой. Мы изучали цифры и дни недели....скучновато. Я попросила преподавателя начать систему времен и на следующем же занятии мы начали Present Simple. Так что не стесняйтесь говорить преподавателю все, что вас не устраивает) - можно попросить другого преподавателя и вам без проблем его заменят - современная интересная платформа для обучения Из минусов: - очень навязчивые менеджеры. Пока вы не оплатите пакет они будут часто вам звонить и спрашивать, когда же вы это сделаете. Как только проходит первое платное занятие они про вас тут же забывают. Да, мне выдали личного менеджера для моих вопросов, но, во-первых, она долго отвечает, во-вторых, отвечает без какого либо желания. У меня было чувство, что я ее отвлекала от каких то более важных дел. - непонятная схема определения вашего уровня владения языком. Я не совсем понимаю как можно точно определить уровень английского по 10-ти минутной беседе и просмотру фильма для первого класса. - Нет возможности покупать от 1го занятия. Только пакетами. В целом, не смотря на все минусы, я рекомендую вам данную школу. Занятия интересные, преподаватель очень грамотная и позитивная. А самое главное, я перестала стесняться говорить! Она просто меня разговорила, за что ей огромное спасибо! Спасибо всем, кто дочитал мой пост до конца. Надеюсь была кому то полезна. Желаю вам успехов в изучении английского языка!)	1	https://irecommend.ru/content/otlichnaya-sovremennaya-onlain-shkola-kotoraya-pomozhet-vam-vyuchit-nakonets-angliiskii
Удобно	Занимаюсь 3 урока. Пока что все нравится. Занимаюсь так же с учителями в Face Time и Zoom, есть с чем сравнить. Удобная площадка , все в одном месте. Система оповещений, работа с домашними заданиями. Была проблема с добавлением бонусных уроков, обратился в службу поддержки через чат. Все решили, уроки добавили. Цена приемлемая. Так как у меня уровень начальный , больше сказать не могу, не знаю на сколько площадка подойдет людям с более высоким уровнем. Если в дальнейшем будут проблемы, обязательно оставлю отзыв.	1	https://irecommend.ru/content/udobno-722
Эффективное и продуктивное обучение в школе!	Конкурентным и показательным преимуществом школы, считаю не только преподавательский состав, а также интерфейс онлайн школы, наличие собственного приложения. Мне есть с чем сравнивать. Для меня, как для ученицы школы, важно как можно быстрее освоить обучение, этому способствуют разговорные клубы, где я стала увереннее говорить на иностранном языке, изучение новых слов, где нет банального перевода на русский, а идет пояснение слова на иностранном языке. Планирую график обучения самостоятельно, подбирая удобное время для себя, в соответствии с моими критериями преподавателя. Школа, как модно говорить, ТОПчик. I recommend!	1	https://irecommend.ru/content/effektivnoe-i-produktivnoe-obuchenie-v-shkole
Замечательно	Очень нравится обучение в школе, преподаватель замечательный, материал полностью доступный, результат виден уже после первого занятия. Заниматься очень удобно, огромный плюс в том, что никуда ненужно ехать, достаточно иметь дома ноутбук или компьютер, нет никаких проблем) Также здорово, что если по какой-то причине преподаватель не понравился его можно сразу поменять. Очень рекомендую попробовать здесь заниматься, не пожалеете)	1	https://irecommend.ru/content/zamechatelno-681
Школа, которую я долго искал	Я несколько раз на протяжении 40 лет пробовал начать учить английский. Я ходил к репетитору, на языковые курсы с оффлайн обучением в различные языковые школы Беларуси, но только сейчас, как мне кажется, я нашел то, что искал. Што мне нравиться в Skyeng: - лучший преподаватель, о котором я и мечтать ранее не мог - онлайн обучение - потрясающая платформа для самостоятельной отработки полученных знаний в ходе урока - изучение новых слов в игровой форме - относительно невысокая стоимость обучения (особенно если брать большой пакет и подождать акционные скидки) и многое другое Для тех, кто еще не определился, советую попробовать.	1	https://irecommend.ru/content/shkola-kotoruyu-ya-dolgo-iskal
Большой портал с многочисленными возможностями	Занимаюсь в sky eng более 2 недель Уровень английского и до занятий был достаточен, но решил подтянуть. Все сервисы сайта удобны понятны и легки в использовании. Много разговорных клубов, talks и разнообразие преподаватель с возможностью заниматься 24 час в сутки Очень интересная фишка с так называемым скрининг тестом. самостоятельные тест сдал на ура, но тест с учителем показал что есть много точек в которых надо расти. Чем сейчас и занимаюсь с выбранным преподавателем Пока доволен всеми предоставляемыми услугами	1	https://irecommend.ru/content/bolshoi-portal-s-mnogochislennymi-vozmozhnostyami
